{
  "story": {
    "title": "AI Diversity: Beyond the Majority",
    "backgroundSetup": "A sophisticated classroom called The Pattern Library, where massive data walls display flowing streams of information representing how AI learns from the world. Professor Bethany, sharp and professional in her tailored business suit with a distinctive purple-streaked bob, teaches students about the hidden biases in artificial intelligence. The room has elegant Display Screens showing training data sets, a central Pattern Recognition Engine that visualizes how AI finds commonalities, and a Diversity Monitor that highlights who gets included and excluded. Holographic projections show both successful and failed AI systems, demonstrating the real-world impact of biased training. IMPORTANT: All characters (Professor Bethany and students) should be positioned in the BOTTOM HALF of the image, with the data walls, Pattern Recognition Engine, Display Screens, and visual demonstrations in the top half.",
    "description": "A critical examination of AI bias and the vital importance of diversity in machine learning, where Professor Bethany challenges students to think beyond the majority and build more inclusive technology."
  },
  "characters": [
    {
      "name": "Professor Bethany",
      "description": "A sharp, professional woman with an air of serious authority balanced by a subtle cheeky wit that emerges when making important points. She wears impeccably tailored business suits in charcoal gray or navy blue, paired with crisp white blouses and elegant low heels. Her bob haircut is precisely cut, jet black with bold purple streaks on one side that hint at her creative thinking and willingness to challenge conventions. She adjusts her thin-framed glasses when examining data and gestures with controlled, purposeful movements. Her expression is thoughtful and penetrating, but a slight smirk plays at her lips when revealing surprising truths about AI systems."
    },
    {
      "name": "Student Eager Noodler",
      "description": "A small, round student with a head shaped like a perfectly smooth, bright green apple, from which two long, springy antennae sprout, constantly twitching with curiosity. They wear an oversized, striped scarf that wraps around them multiple times, ending in a tassel that bounces as they nod vigorously. Their eyes are wide and perpetually amazed, and they often have a tiny, wobbly pencil clutched in a three-fingered hand, ready to scribble notes."
    },
    {
      "name": "student Thoughtful Giggler",
      "description": "A tall, lanky student with a head that's a stack of three wobbly, different-sized spheres, each a different shade of blue. They have enormous, floppy ears that droop when they're confused and perk up when they understand. Their smile is wide and stretches almost ear to ear, and they often emit soft, bubbling giggles as they ponder concepts. They wear pants that are far too short, revealing long, segmented legs that end in enormous, flat feet."
    },
    {
      "name": "Student Zippy Zapper",
      "description": "A vibrant, energetic student whose body is a series of interconnected, brightly colored zig-zags, always in motion. Their hair is a burst of spiky yellow and orange, standing straight up as if charged with static. They have four small, quick-moving arms, each ending in a suction cup, and their large, round eyes dart around, taking everything in. They have no discernible mouth but communicate through a series of enthusiastic 'boings' and 'zings'"
    },
    {
      "name": "Student Quiet observer",
      "description": "A shy, somewhat squarish student with a soft, fuzzy purple body and tiny, barely visible legs. Their head is a perfect cube, and instead of eyes, they have two large, circular lenses that slowly adjust, observing everything with intense focus. They carry a small, portable periscope that they often peer through, even in class. They rarely speak, but when they do, it's in a gentle, melodious hum, and they often sketch intricate diagrams in a tiny notebook."
    }
  ],
  "elements": [
    {
      "name": "The Pattern Library",
      "description": "A sleek, modern classroom with floor-to-ceiling data walls that shimmer with flowing information streams. The walls display training datasets, statistical distributions, and demographic representations. Elegant wooden shelves hold physical examples of biased AI outputs. The space has a professional, academic atmosphere with comfortable seating arranged in a semicircle facing the demonstration area.",
      "category": "Rooms"
    },
    {
      "name": "Pattern Recognition Engine",
      "description": "A sophisticated holographic display in the center of the room that visualizes how AI systems find patterns in data. It shows glowing nodes connecting common features, with bright lines indicating strong patterns and dim lines showing rare occurrences. The engine can highlight which patterns dominate and which get ignored, making bias visible to the eye.",
      "category": "Machinery"
    },
    {
      "name": "Data Walls",
      "description": "Massive vertical screens displaying flowing streams of training data. Each stream represents different demographic groups, use cases, and scenarios. Some streams are thick and bright, representing overrepresented data. Others are thin and faint, showing underrepresented populations. The walls can zoom in to show individual data points or zoom out to reveal systemic patterns.",
      "category": "Set Pieces"
    },
    {
      "name": "Diversity Monitor",
      "description": "A diagnostic display that measures the diversity of training data and AI outputs. It shows demographic breakdowns, representation percentages, and highlights gaps where certain groups are excluded. The monitor glows green when systems are inclusive and flashes red when bias is detected. It provides quantitative measures of fairness and representation.",
      "category": "Machinery"
    },
    {
      "name": "Impact Gallery",
      "description": "A wall displaying real-world examples of AI successes and failures. Success stories show inclusive AI that works for everyone. Failures show biased systems that harmed underrepresented groups—facial recognition that doesn't work for darker skin, voice assistants that don't understand accents, medical AI trained only on majority populations. Each example has annotations explaining what went wrong.",
      "category": "Set Pieces"
    }
  ],
  "scenes": [
    {
      "title": "Welcome: The Promise and Problem",
      "description": "Professor Bethany stands before the Data Walls with her arms crossed, her purple-streaked bob catching the light from the flowing data streams. She adjusts her glasses and gestures at the Pattern Recognition Engine, which glows with interconnected nodes. Her expression is serious but her eyes have that characteristic glint of someone about to reveal an uncomfortable truth. Student Eager Noodler's antennae twitch nervously while student Thoughtful Giggler's smile fades into thoughtful concern. The Data Walls show AI being used everywhere—healthcare, hiring, lending, criminal justice—highlighting both promise and peril.",
      "textPanel": "\"Welcome students to AI's grand domain,\nWhere patterns emerge from data's terrain.\nBut here's the truth that we must face today:\nProbability can lead our systems astray.\"",
      "diagramPanel": {
        "type": "markdown",
        "content": "# AI/ML: Learning from Probability\n\n## How AI Works:\n\n**Training Process:**\n1. Collect data from the world\n2. Find patterns and correlations\n3. Learn what's most common\n4. Predict based on probability\n\n```python\n# AI learns the most probable outcome\nmodel.train(training_data)  # Learn patterns\nprediction = model.predict(new_data)  # What's most likely?\n```\n\n**The Core Issue:**\n> AI systems optimize for the **most common** patterns in their training data. Whatever appears most frequently becomes the \"right\" answer.\n\n*But most common ≠ universally applicable*",
        "language": "markdown",
        "style": {
          "boardStyle": "whiteboard",
          "position": "top-center",
          "widthPercentage": 90,
          "heightPercentage": 35,
          "autoScale": true,
          "backgroundColor": "#2d3748",
          "foregroundColor": "#ffffff",
          "borderColor": "#8b7355",
          "borderWidth": 3,
          "padding": 15,
          "fontSize": 15,
          "gutterTop": 20,
          "gutterBottom": 0,
          "gutterLeft": 0,
          "gutterRight": 0
        }
      },
      "characters": ["Professor Bethany", "Student Eager Noodler", "student Thoughtful Giggler", "Student Zippy Zapper", "Student Quiet observer"],
      "elements": ["The Pattern Library", "Pattern Recognition Engine", "Data Walls"]
    },
    {
      "title": "Training Data: The Foundation",
      "description": "Professor Bethany walks along the Data Walls, her heels clicking purposefully on the floor. She points at the flowing streams with a slight smirk, showing how some streams are thick and bright while others are barely visible threads. The Pattern Recognition Engine begins processing, and students watch as it gravitates toward the dominant patterns, almost ignoring the fainter streams. Student Quiet observer peers through their periscope at the neglected data. Professor Bethany's expression becomes more serious as she explains what the students are witnessing.",
      "textPanel": "\"AI learns from data that we provide,\nBut ask yourself: whose stories does it hide?\nThe patterns strong become what AI knows best,\nWhile quieter voices fail the training test.\"",
      "diagramPanel": {
        "type": "markdown",